{
  "schemaVersion": "v1alpha1",
  "kind": "execution-envelope",
  "runId": "synthetic-run",
  "planDigest": "sha256:7777777777777777777777777777777777777777777777777777777777777777",
  "startedAt": "2026-10-01T12:00:00Z",
  "host": {
    "os": "windows",
    "arch": "amd64"
  },
  "context": "local",
  "identity": {
    "subject": "synthetic-local",
    "verification": "local"
  },
  "policy": {
    "decisionIds": []
  },
  "facts": []
}
